Term,Occurrence (ead_ID),Tag,Collection,Context
Anishnaabe,umich-bhl-2018025,scopecontent,the John P. Murphy collection,"Researchers should note that the collection includes materials depicting Anishnaabe peoples, families, homes, and culture from a white colonial lens."
Burial,umich-bhl-85831,bioghist,Joseph Beal Steere Papers,On the Island of Marajo he excavated huge prehistoric burial mounds.
Burial,umich-bhl-85189,bioghist,Amos R. Green Papers,"He threw himself, too, into the practice of archaeology, excavating burial mounds and surveying construction sites."
Burials,umich-bhl-2018025,bioghist,the John P. Murphy collection,"The location is a sacred site for the Anishinaabe, a place for burials and worship, which was seen as a curiosity and tourist attraction by white visitors."
Burials,umich-bhl-0383,subjects,George R. Fox (1880-1963) Papers,Archaeology.; Mounds; Archaeology.; Mounds (Burials)
Captive,umich-bhl-89405,bioghist,"Robert M. Warner Papers, 1945-2007",By 1983 it had become clear to Warner that NARS could no longer remain a captive of GSA if it was to be an effective organization.
Chief,umich-bhl-2020007,scopecontent,the Rick Snyder papers.,"Of note are the Appointments files regarding emergency managers in various Michigan cities, Chief of Staff materials on public health policy, and the Legal Division materials related to the state's interactions with Michigan’s Native American tribes."
Chief,umich-bhl-8924,bioghist,William G. Milliken Papers," Although chief executive during the deepest economic crisis experienced in Michigan since the Depression, Governor Milliken was generally popular among both the people of the state and his political peers."
Chief,umich-bhl-85926,scopecontent,the Chauncy Bush minute book,"Harris, and delegations of Sioux and Sauk-Fox Indians from along the Mississippi River, including the Sauk-Fox chief Keokuk."
Chief,umich-bhl-2014150,bioghist,"Carl M. Levin papers, 1938-2015.",He also served as special assistant attorney general for the state of Michigan and chief appellate defender for the city of Detroit (1968-1969).
Chief,No EAD ID,titleproper,"the Ka-na-pi-ma [graphic] : an Ottawa chief / drawn, printed &amp; coloured at J. T. Bowen's lithographic establishment, No. 94, Walnut Street.","the Ka-na-pi-ma [graphic] : an Ottawa chief / drawn, printed &amp; coloured at J."
Chief,umich-bhl-9940,scopecontent,"James J. Blanchard Papers, 1982-2002","This is manifest in the myriad array of units heavily reliant on the Issues Development Office for their own operations; the Chief of Staff, Executive Assistants, Correspondence, Government Relations, Legal, and Press Offices all were in daily contact with Issues."
Chief,umich-bhl-9940,scopecontent,"James J. Blanchard Papers, 1982-2002"," The efforts of the Chief of Staff to facilitate frictionless functioning of state governance were augmented by able deputies, competent staff, and a cadre of Executive Assistants."
Chief,umich-bhl-9940,scopecontent,"James J. Blanchard Papers, 1982-2002",One finds that roles filled by a chief of staff sometimes devolved to an executive assistant or to a staff member in the Legal or Government Relations Office.
Chief,umich-bhl-9940,scopecontent,"James J. Blanchard Papers, 1982-2002","Blanchard, as Governor of Michigan, was the chief executive of the state."
Chief,umich-bhl-9940,abstract,"James J. Blanchard Papers, 1982-2002","These series are chief of staff/executive assistants, correspondence office, government relations, issues development, legal department, operators, personnel, press office, Upper Peninsula office, Washington office, Lansing residence, and political and campaign files."
Chief,umich-bhl-2013030,scopecontent,"Glen Sheppard Papers, 1940s-2010","These agencies include government bodies devoted to conservation issues, chief among which is the DNR (Department of Natural Resources)."
Chief,umich-bhl-861078,bioghist,"Mary Shurtleff collection, 1848-1915 (scattered dates)","In the late 1840s, several Ottawa pooled their resources and gave their chief, Joseph Nawimashkote ""full power to purchase land for use at the cross, that we may own it in common"" (Shurtleff, 1963, p."
Chief,umich-bhl-850,bioghist,John and Leni Sinclair Papers,"Sinclair served as Arts Editor and later as Editor-in-chief of the Detroit <title render=""italic"">Sun</title> (moved from Ann Arbor) until publication was suspended in October 1976."
Chief,umich-bhl-850,bioghist,John and Leni Sinclair Papers," Sinclair also established his own independent record label, Total Energy Records, along with a production company called Big Chief Productions."
Chief,No EAD ID,titleproper,"the Ka-na-pi-ma [graphic] : an Ottawa chief / drawn, printed &amp; coloured at J. T. Bowen's lithographic establishment, No. 94, Walnut Street.","the Ka-na-pi-ma [graphic] : an Ottawa chief / drawn, printed &amp; coloured at J."
Chief,umich-bhl-851362,persnames,"Emerson Frank Greenman Papers, 1888-1984 (bulk dates, 1924-1972)","Greenman, Emerson Frank, 1895-1973; Pontiac, Ottawa Chief, -1769; Greenman, Emerson Frank, 1895-1973"
Chief,umich-bhl-85926,persnames,the Chauncy Bush minute book,"Bush, Chauncy.; Harris, Carey A.; Keokuk, Sauk Chief, 1780-1840; Poinsett, Joel Roberts, 1779-1851"
Chief,umich-bhl-9940,scopecontent,"James J. Blanchard Papers, 1982-2002", The Chief of Staff had the primary responsibility for seeing to the efficient functioning of the executive office of the Governor.
Chief,umich-bhl-2020007,bioghist,the Rick Snyder papers.,"He served as president and chief operating officer from 1996-1997, and a board member from 1997 – 2007  During this period, Gateway became a Fortune 500 Company growing from 600 people to 13,000 and $600mm in revenue to $6 billion."
Chief,umich-bhl-85243,bioghist,"W. Wallace Kent papers, 1954-1973","Judge Kent was appointed as Chief Judge of the Western District of Michigan in 1962, and retained that position until 1970, when he was appointed to the Sixth Circuit Court of Appeals."
Chief,umich-bhl-8667,bioghist,John B. Swainson Papers,"Swainson lost, and contributing to his defeat, in addition to Romney's popularity, were the state's continuing financial woes and the fact that the Michigan's chief executive had been a Democrat since 1948."
Chief,No EAD ID,bioghist,the Nauke-Chig-Um-Ie photograph collection.,"Probably Nau-Qua-Chic-A-Ming, Ojibwa chief."
Chief,umich-bhl-8667,bioghist,John B. Swainson Papers,"In January 1973, he was selected to serve as Deputy Chief Justice."
Chief,umich-bhl-86550,bioghist,Alexander G. Ruthven Papers,"Also, before assuming the presidency, Ruthven was chief field naturalist with the Michigan Geological and Biological Survey (1908-1912)."
Chief,umich-bhl-86393,bioghist,G. Mennen Williams Papers,"He headed a reform movement within the judiciary to make administration of justice ""effective and efficient."" He served so capably during his first term that he was easily re-elected in 1978 and was elected Chief Justice by his peers in April 1983."
Chief,umich-bhl-8868,bioghist,"Blanchard Family Papers, ca. 1835-ca. 2000","Blanchard then graduated from Dio Lewis's Normal Institute for Physical Education in 1863 and was a ""New Gymnastics"" instructor before becoming the editor-in-chief of the <title render=""italic"">Boston Daily Voice</title>."
Chief,No EAD ID,titleproper,the Shin-ga-ba-w'ossin [graphic] : a Chippeway chief / printed &amp; coloured at I. T. Bowen's lithographic establishment No. 94 Walnut St.,the Shin-ga-ba-w'ossin [graphic] : a Chippeway chief / printed &amp; coloured at I.
Chief,umich-bhl-8868,bioghist,"Blanchard Family Papers, ca. 1835-ca. 2000",By 1918 the USDA recognized his laboratory as the Bureau of Plant Industry's Division of Nematology and Cobb had become the government's chief nematologist.
Chief,umich-bhl-8667,scopecontent,John B. Swainson Papers,"Swainson collection consists of four subgroups of files: pre-gubernatorial (covering the period of 1943 to 1960), gubernatorial (covering his one-term, two-year tenure as the state's chief executive), post-gubernatorial (covering the years since he left the governor's office, 1963 to 1975), and visual materials."
Chief,No EAD ID,persnames,the Shin-ga-ba-w'ossin [graphic] : a Chippeway chief / printed &amp; coloured at I. T. Bowen's lithographic establishment No. 94 Walnut St.,"Bowen, John T., approximately 1801-1856?; Shingaba W'Ossin, Ojibwa Chief; Greenough, F."
Chief,umich-bhl-8868,bioghist,"Blanchard Family Papers, ca. 1835-ca. 2000","Although he briefly entertained a 1902 offer from James Wilson, Head of the United States Department of Agriculture (USDA), to become the Chief of the Bureau of Tropical Agriculture in Manila, Cobb elected to stay on with the NSW Department of Agriculture."
Chief,No EAD ID,persnames,the Black Hawk visual material collection.,"Black Hawk, Sauk chief, 1767-1838"
Chiefs,umich-bhl-8722,scopecontent,Board of Regents (University of Michigan) records,"By treaty, the chiefs, sachems, and warriors of four Indeginous nations, the Ottawa (Odawa), Ojibwe (Ojibwa, Chippewa), Wyandotte (Wyandot), and Potawatomi (Bodéwadmi, Potawatomie, Patawatima) ceeded the land northwest of the Ohio river to the United States of America."
Chiefs,umich-bhl-851588,scopecontent,"George Johnston letterbook, 1832-1860",Included are copies of letters from Chippewa Indian chiefs appealing to the President of the United States to honor its past treaties with the Indians.
Chiefs,umich-bhl-86143,bioghist,C. C. Trowbridge Papers,"In 1821, Secretary of War Calhoun appointed Trowbridge as Indian agent with responsibility of accompanying chiefs and representatives of the Six Nations of New York state to Green Bay for the purpose of finding suitable lands where the Six Nations might resettle."
Chiefs,umich-bhl-9940,scopecontent,"James J. Blanchard Papers, 1982-2002","During Blanchard's two terms in office, he was served by four Chiefs of Staff: F."
Chiefs,umich-bhl-9940,scopecontent,"James J. Blanchard Papers, 1982-2002","Given that the Blanchard administration was democratic and decidedly non-hierarchical, these Executive Assistants often filled roles similar to the Chiefs of Staff."
Chiefs,umich-bhl-85221,bioghist,Johnston Family Papers,"1843), the daughter of one of their chiefs, named Waubojeeg."
Chippewa,umich-bhl-2012101,bioghist,the John Christian Auch papers,"Genesee County is located on the ancestral land of the Ojibwe (Chippewa), Odawa (Ottawa) and Sauk people."
Chippewa,umich-bhl-87423,scopecontent,the American Baptist Missionary Union records,"Mills and includes a land grant dated January 1850 that details how the proceeds from the sale of lands along the Grand River (probably near Grand Rapids, Mich.) under the provisions of a treaty between the United States and the Ottawa and Chippewa Indians should be divided between Baptist and Catholic missionary interests, both of whom had developed missions in the area."
Chippewa,umich-bhl-93347,geognames,"Postcard collection, 1890s-[ongoing]","Ada (Mich.); Addison (Mich.); Adrian (Mich.); Ahmeek (Mich.); Akron (Mich.); Alba (Mich.); Albion (Calhoun County, Mich.); Alcona (Mich.); Alden (Mich.); Algonac (Mich.); Allegan (Mich.); Allendale (Mich.); Alma (Mich.); Alpena (Mich.); Ann Arbor (Mich.); Arcadia (Mich.); Askel (Mich.); Atlanta (Mich.); Au Sable River (Mich.); Au Train (Mich.); Auburn (Mich.); Augusta (Mich.); Bad Axe (Mich.); Baldwin (Mich.); Bangor (Mich.); Baraga (Mich.); Barron Lake (Mich.); Base Line Lake (Mich.); Battle Creek (Mich.); Bay City (Mich.); Bay View (Mich.); Beaver Island (Mich.); Beaverton (Mich.); Belding (Mich.); Bellaire (Mich.); Belleville (Mich.); Bellevue (Mich.); Bendon (Mich.); Benton Harbor (Mich.); Benzonia (Mich.); Berrien Springs (Mich.); Beulah (Mich.); Big Rapids (Mich.); Birmingham (Mich.); Blaney Park (Mich.); Blissfield (Mich.); Bloomfield Hills (Mich.); Bloomingdale (Mich.); Boblo Island Amusement Park (Ont.); Boyne City (Mich.); Boyne Falls (Mich.); Brevort (Mich.); Brighton (Mich.); Brooklyn (Mich.); Brown City (Mich.); Brutus (Mich.); Buchanan (Mich.); Buckley (Mich.); Bunker Hill (Mich.); Burt Lake (Mich.); Byron (Mich.); Cadillac (Mich.); Calcite (Mich.); Calderwood (Mich.); Caledonia (Mich.); Calumet (Mich.); Caro (Mich.); Capac (Mich.); Carp Lake (Mich.); Carson City (Mich.); Carsonville (Mich.); Caseville (Mich.); Casnovia (Mich.); Cass City (Mich.); Cassopolis (Mich.); Cedar (Mich.); Cedar Springs (Mich.); Cedarville (Mich.); Cement City (Mich.); Central Lake (Mich.); Centreville (Mich.); Charlevoix (Mich.); Charlotte (Mich.); Cheboygan (Mich.); Chelsea (Mich.); Chesaning (Mich.); Chippewa Lake (Mich.); Clare (Mich.); Clarklake (Mich.); Clarkston (Mich.); Clifton (Mich.); Clinton (Mich.); Clio (Mich.); Cloverdale (Mich.); Clyde (Mich.); Cohoctah (Mich.); Coldwater (Mich.); Coleman (Mich.); Coloma (Mich.); Colon (Mich.); Columbiaville (Mich.); Concord (Mich.); Constantine (Mich.); Conway (Mich.); Coopersville (Mich.); Copemish (Mich.); Copper Harbor (Mich.); Corunna (Mich.); Coryell (Mich.); Crooked River (Mich.); Cross Village (Mich.); Croswell (Mich.); Croton (Mich.); Crystal (Mich.); Crystal Falls (Mich.); Crystal Lake (Mich."
Chippewa,umich-bhl-86395,abstract,"Peter Barbeau Papers, 1789-1909","State representative from Chippewa County, Michigan."
Chippewa,umich-bhl-2012101,scopecontent,the John Christian Auch papers,"One of the certificates was issued to Sha-sha-o-ne-besse, a member of the Saginaw Band of the Ojibwe (Chippewa) tribe."
Chippewa,umich-bhl-2018025,scopecontent,the John P. Murphy collection,"Another main subject is views of surrounding communities, including those of the Ojibwe (sometimes anglicized as Chippewa), supplemented with portraits and scenes of domestic life."
Chippewa,umich-bhl-92456,geognames,"Penrod/Hiawatha Company Postcard Collection, 1950s-2017","Ada (Mich.); Adrian (Mich.); Albion (Calhoun County, Mich.); Algonac (Mich.); Allen Park (Mich.); Allendale (Mich.); Alma (Mich.); Aloha State Park (Mich.); Alpena (Mich.); Ann Arbor (Mich.); Arcadia (Mich.); Askel (Mich.); Athens (Mich.); Au Sable River (Mich.); Baldwin (Mich.); Battle Creek (Mich.); Bay City (Mich.); Bear Lake (Mich.); Beaver Island (Mich.); Bellaire (Mich.); Belle Isle (Detroit, Mich.); Benton Harbor (Mich.); Benzie State Park (Mich.); Benzonia (Mich.); Berrien Springs (Mich.); Bessemer (Mich.); Bete Grise (Mich.); Beulah (Mich.); Big Bay (Mich.); Big Rapids (Mich.); Birmingham (Mich.); Bloomfield Hills (Mich.); Bob-Lo Amusement Park (Ont.); Boyne City (Mich.); Brighton (Mich.); Brimley (Mich.); Brockway Mountain (Mich.); Buchanan (Mich.); Burt Lake State Park (Mich.); Cadillac (Mich.); Calumet (Mich.); Caro (Mich.); Cassopolis (Mich.); Cedar River (Mich.); Cedar Springs (Mich.); Cedarville (Mich.); Centreville (Mich.); Charlevoix (Mich.); Cheboygan (Mich.); Chelsea (Mich.); Christmas (Mich.); Clare (Mich.); Clinton (Lenawee County, Mich.); Coldwater (Mich.); Coloma (Mich.); Colon (Mich.); Copper Harbor (Mich.); Croton (Mich.); Crystal Falls (Mich.); Curtis (Mich.); De Tour Village (Mich.); Dearborn (Mich.); Decatur (Mich.); Detroit (Mich.); Dexter (Mich.); Dowagiac (Mich.); Drummond Island (Mich.); Dundee (Mich.); Durand (Mich.); Eagle Harbor (Mich.); East Lansing (Mich.); East Tawas (Mich.); Eaton Rapids (Mich.); Elk Rapids (Mich.); Escanaba (Mich.); Fayette (Mich.); Flint (Mich.); Fort Wilkins (Mich.); Frankenmuth (Mich.); Frankfort (Mich.); Franklin (Mich.); Freeland (Mich.); Fremont (Mich.); Gaylord (Mich.); Gladstone (Mich.); Glen Arbor (Mich.); Glen Haven (Mich.); Glennie (Mich.); Good Hart (Mich.); Grand Haven (Mich.); Grand Marais (Mich.); Grand Rapids (Mich.); Grand Traverse Bay (Mich.); Grayling (Mich.); Greenville (Mich.); Grosse Pointe (Mich.); Gull Lake (Mich.); Gwinn (Mich.); Hamtramck (Mich.); Hancock (Mich.); Harbor Springs (Mich.); Hardy Dam (Mich.); Harper Woods (Mich.); Harrison (Mich.); Hartwick Pines State Park (Mich.); Hastings (Mich.); Hell (Mich.); Hessel (Mich.); Hiawatha National Forest (Mich.); Higgins Lake (Mich.); Highland Park (Mich.); Hillsdale (Mich.); P.J. Hoffmaster State Park (Mich.); Holland (Mich.); Honor (Mich.); Houghton (Mich.); Houghton Lake (Mich.); Indian River (Mich.); Interlochen (Mich.); Interlochen State Park (Mich.); Ionia (Mich.); Irish Hills (Mich.); Iron Mountain (Mich.); Iron River (Mich.); Ironton (Mich.); Ironwood (Mich.); Ishpeming (Mich.); Isle Royale (Mich.); Jackson (Mich.); Kalamazoo (Mich.); Kalkaska (Mich.); Kewadin (Mich.); Lac La Belle (Mich.); Lake Ann (Mich.); Lake City (Mich.); Lake Leelanau (Mich.); L'Anse (Mich.); Lansing (Mich.); Leland (Mich.); Les Cheneaux Islands (Mich.); Lincoln Park (Mich.); Little Girl's Point (Mich.); Little Traverse Bay (Mich.); Livonia (Mich.); Lowell (Mich.); Ludington (Mich.); Ludington State Park (Mich.); Mackinac, Straits of (Mich.); Mackinac Bridge (Mich.); Mackinac Island (Mich.); Mackinac Island (Mich.); Mackinaw City (Mich.); Manistee (Mich.); Manistique (Mich.); Marinette (Wis.); Marion (Mich.); Marquette (Mich.); Mason (Mich.); Mears (Mich.); Menominee (Mich.); Mesick (Mich.); Midland (Mich.); Milford (Mich.); Mio (Mich.); Mitchell State Park (Mich.); Monroe (Mich.); Montague (Mich.); Mount Clemens (Mich.); Mount Pleasant (Mich.); Munising (Mich.); Muskegon (Mich.); Muskegon State Park (Mich.); Naubinway (Mich.); New Buffalo (Mich.); Newaygo (Mich.); Newberry (Mich.); Niles (Mich.); Northport (Mich.); Northville (Mich.); Old Mill Creek State Park (Mich.); Old Mission Point (Mich.); Omena (Mich.); Onekama (Mich.); Orchard Beach State Park (Mich.); Oscoda (Mich.); Otsego Lake State Park (Mich.); Owosso (Mich.); Paradise (Mich.); Paulding (Mich.); Paw Paw (Mich.); Pentwater (Mich.); Peshawbestown (Mich.); Petoskey (Mich.); Petoskey State Park (Mich.); Pictured Rocks National Lakeshore (Mich.); Plymouth (Mich.); Pontiac (Mich.); Porcupine Mountains State Park (Mich.); Port Huron (Mich.); Prudenville (Mich.); Rapid River (Mich.); Reed City (Mich.); Rochester (Mich.); Rockford (Mich.); Rogers City (Mich.); Romulus (Mich.); Roscommon (Mich.); Roseville (Mich.); Royal Oak (Mich.); Saginaw (Mich.); Saint Clair (Mich.); Saint Ignace (Mich.); Saint Johns (Mich.); Saint Joseph (Mich.); Saugatuck (Mich.); Sault Sainte Marie (Mich.); Scottville (Mich.); Seney National Wildlife Refuge (Mich.); Silver Lake (Oceana County, Mich.); Sister Lakes (Mich.); Sleeping Bear Dunes National Lakeshore (Mich.); South Haven (Mich.); South Manitou Island (Mich.); Southfield (Mich.); Spring Lake (Mich.); Sterling Heights (Mich.); Stony Lake (Mich.); Sturgeon Point (Alcona County, Mich.); Sturgis (Mich.); Suttons Bay (Mich.); Upper Falls (Luce County, Mich.); Lower Falls (Chippewa County, Mich.); Tahquamenon River (Mich.); Tawas Bay (Mich.); Tawas Point State Park (Mich.); Taylor (Mich.); Tecumseh (Mich.); Three Rivers (Mich.); Torch Lake (Mich.); Tourism.; Traverse City (Mich.); Trenton (Mich.); Troy (Mich.); Union Pier (Mich.); Vandalia (Mich.); Wakefield (Mich.); Walloon Lake (Mich.); Warren (Mich.); Warren Dunes State Park (Mich.); West Branch (Mich.); Westland (Mich.); White Cloud (Mich.); Whitefish Point (Mich.); Whitehall (Mich.); Yankee Springs Recreation Area (Mich.); Ypsilanti (Mich.)"
Chippewa,umich-bhl-2012101,geognames,the John Christian Auch papers,Saginaw Chippewa Indian Tribe of Michigan.
Chippewa,umich-bhl-86727,geognames,"Stellanova Osborn papers, 1907-1988","Sugar Island (Mich.); Ann Arbor (Mich.); Duck Island (Chippewa County, Mich.); Ewen (Mich.); Indiana; Jackson (Mich.); Poulon (Ga.)"
Chippewa,umich-bhl-861078,bioghist,"Mary Shurtleff collection, 1848-1915 (scattered dates)", Treaties between the United States Government and the Ottawa and Chippewa (several of whom had moved to Cross Village sometime after 1830) resulted in them being granted tracts of land in the area during the mid-to-late nineteenth century.
Chippewa,umich-bhl-2016048,bioghist,Warren Petoskey papers,"Warren Donald Petoskey is an elder of the Waganakising Odawa and Minneconjou Lakotah nations, member of the Bear Clan, and a citizen of the Little Traverse Bay Band of Ottawa and Chippewa Indians."
Chippewa,No EAD ID,scopecontent,"the The snow-shoe dance [graphic] : to thank the Great Spirit for the first appearance of snow / Catlin, del.","Shows Chippewa Indians near Fort Snelling, Minnesota, ca."
Chippewa,umich-bhl-9317,abstract,the Andrew Wheaton photograph collection,"Consists of group and individual portraits of Ojibwa (also referred to as Ojibwe, Chippewa, or Anishinabe) residents of Nahma, Michigan."
Chippewa,umich-bhl-9317,scopecontent,the Andrew Wheaton photograph collection,"The collection consists of group and individual portraits of Ojibwa (also referred to as Ojibwe, Chippewa, or Anishinabe) residents of Nahma, Michigan."
Chippewa,umich-bhl-85997,bioghist,"Johan G.R. BanÃ©r papers, 1890-1938","Banér also began to write poetic accounts of Scandinavian epics, as well as translations of Chippewa legends, myths and folklore; he wrote literally thousands of articles and poems for the nation's Swedish language press."
Chippewa,umich-bhl-852041,scopecontent,"John Monteith papers, 1797-1885 [microform]","Besides the letters there are diaries kept by Monteith (1815-1838), notes on his library, sermons and a volume of sermon outlines, speeches, notes on class lectures and other subjects, personal account books, a notebook (1820) containing Chippewa-English vocabulary, student notes (1797-1798) taken by Alexander Monteith at Dickinson College."
Chippewa,umich-bhl-85150,bioghist,"Marvin Fisher papers, 1972-1976","Marvin Fisher was a Chippewa Indian activist from Bay City, Michigan."
Chippewa,umich-bhl-85150,abstract,"Marvin Fisher papers, 1972-1976","Chippewa Indian from Bay City, Michigan."
Chippewa,No EAD ID,corpnames,"the Sault Sainte Marie, Michigan print collection.","Chippewa House (Sault Sainte Marie, Mich.)"
Chippewa,umich-bhl-86395,geognames,"Peter Barbeau Papers, 1789-1909",Chippewa County (Mich.); Mackinac Island (Mich.); Marquette (Mich.); Upper Peninsula (Mich.); Sault Sainte Marie (Mich.); Sault Sainte Marie Canal (Mich.); United States
Chippewa,umich-bhl-86395,bioghist,"Peter Barbeau Papers, 1789-1909","He owned and took possession of Chippewa Street, which was later changed to Barbeau."
Chippewa,umich-bhl-85761,scopecontent,the John C. Blanchard papers,"Two legal documents from Chippewa Indians living on Walpole Island, Ontario, granting power of attorney to W."
Chippewa,umich-bhl-89151,scopecontent,"the United States, Bureau of Indian Affairs records","Quarterly reports of the Sheboigan Indian School, 1857-1865 [photostats (negative)]; 1870 annuity pay rolls of the Ottawa and Chippewa Indians of Michigan [Microfilm (positive) and photocopy]; 1908 census of the Michigan Chippewas (353 p.); and 1910 annuity roll of the Ottawas and Chippewas of Michigan (215 p.) [Microfilm (positive)]; 1908 and 1910 rolls taken by Horace B."
Chippewa,umich-bhl-851568,scopecontent,the Isabella Indian Mission historical sketch,"History of the missionary activities of the Methodist Episcopal Church among the Chippewa Indians in Isabella County, Michigan and vicinity, 1841-1890."
Chippewa,umich-bhl-2011121,bioghist,"Camp Al-Gon-Quian (Burt Lake, Mich.) records, 1926-1967","Throughout the years, the tribes within the camp included the Ottawa, Chippewa, Cree, Ojibwa, Miami, Nipissing and Mississauga."
Chippewa,umich-bhl-89425,scopecontent,the Elmer E. White court file,"Legal brief, 1977, prepared in the case of the Children of the Chippewa, Ottawa and Potawatomy Tribes and Paul J."
Chippewa,No EAD ID,geognames,the Henry Rowe Schoolcraft papers,Chippewa County (Mich.); Mackinac Island (Mich.); Sault Sainte Marie (Mich.)
Chippewa,No EAD ID,scopecontent,the Henry Rowe Schoolcraft papers,"Marie, Michigan; letter concerning taxable inhabitants of Chippewa County, Michigan, letter of invitation from Mrs."
Chippewa,umich-bhl-8822,scopecontent,the Reuben Beeman land sale agreements,"Mortgage and warranty deed of Beeman of Saginaw, Michigan, with Sa-Wa-Bon, Chippewa Indian, for land in Saginaw County, Michigan."
Chippewa,umich-bhl-2014109,geognames,the Crisca Bierwert papers,Swan Creek and Black River Bands of Chippewa Indians.
Chippewa,umich-bhl-89139,bioghist,the Charles H. Rodd papers,"Part-Indian trader at Midland, Michigan, and interpreter with the Chippewa Indians of Isabella County, Michigan."
Chippewa,umich-bhl-851588,bioghist,"George Johnston letterbook, 1832-1860","George Johnston (also spelled Johnson) was the son of John Johnston, an Irish immigrant and O-Shau-gus-co-day-way-gua, a Chippewa Indian woman."
Chippewa,umich-bhl-851588,scopecontent,"George Johnston letterbook, 1832-1860",Included are copies of letters from Chippewa Indian chiefs appealing to the President of the United States to honor its past treaties with the Indians.
Chippewa,umich-bhl-851588,abstract,"George Johnston letterbook, 1832-1860","Sub-Indian agent at La Pointe, Wisconsin, later surveyor of Indian lands in Michigan's Upper Peninsula, and interpreter among the Chippewa Indians."
Chippewa,umich-bhl-8722,scopecontent,Board of Regents (University of Michigan) records,"By treaty, the chiefs, sachems, and warriors of four Indeginous nations, the Ottawa (Odawa), Ojibwe (Ojibwa, Chippewa), Wyandotte (Wyandot), and Potawatomi (Bodéwadmi, Potawatomie, Patawatima) ceeded the land northwest of the Ohio river to the United States of America."
Chippewa,umich-bhl-88175,bioghist,the Cog-gog-e-was land patents,The Ojibwa (Chippewa) are an Anishinaabe people of Canada and the northern Midwestern United States.
Colonial,umich-bhl-2018025,scopecontent,the John P. Murphy collection,"Researchers should note that the collection includes materials depicting Anishnaabe peoples, families, homes, and culture from a white colonial lens."
