Term,Occurrence (ead_ID),Tag,Collection,Context
Indian,umich-bhl-92456,geognames,"Penrod/Hiawatha Company Postcard Collection, 1950s-2017","Ada (Mich.); Adrian (Mich.); Albion (Calhoun County, Mich.); Algonac (Mich.); Allen Park (Mich.); Allendale (Mich.); Alma (Mich.); Aloha State Park (Mich.); Alpena (Mich.); Ann Arbor (Mich.); Arcadia (Mich.); Askel (Mich.); Athens (Mich.); Au Sable River (Mich.); Baldwin (Mich.); Battle Creek (Mich.); Bay City (Mich.); Bear Lake (Mich.); Beaver Island (Mich.); Bellaire (Mich.); Belle Isle (Detroit, Mich.); Benton Harbor (Mich.); Benzie State Park (Mich.); Benzonia (Mich.); Berrien Springs (Mich.); Bessemer (Mich.); Bete Grise (Mich.); Beulah (Mich.); Big Bay (Mich.); Big Rapids (Mich.); Birmingham (Mich.); Bloomfield Hills (Mich.); Bob-Lo Amusement Park (Ont.); Boyne City (Mich.); Brighton (Mich.); Brimley (Mich.); Brockway Mountain (Mich.); Buchanan (Mich.); Burt Lake State Park (Mich.); Cadillac (Mich.); Calumet (Mich.); Caro (Mich.); Cassopolis (Mich.); Cedar River (Mich.); Cedar Springs (Mich.); Cedarville (Mich.); Centreville (Mich.); Charlevoix (Mich.); Cheboygan (Mich.); Chelsea (Mich.); Christmas (Mich.); Clare (Mich.); Clinton (Lenawee County, Mich.); Coldwater (Mich.); Coloma (Mich.); Colon (Mich.); Copper Harbor (Mich.); Croton (Mich.); Crystal Falls (Mich.); Curtis (Mich.); De Tour Village (Mich.); Dearborn (Mich.); Decatur (Mich.); Detroit (Mich.); Dexter (Mich.); Dowagiac (Mich.); Drummond Island (Mich.); Dundee (Mich.); Durand (Mich.); Eagle Harbor (Mich.); East Lansing (Mich.); East Tawas (Mich.); Eaton Rapids (Mich.); Elk Rapids (Mich.); Escanaba (Mich.); Fayette (Mich.); Flint (Mich.); Fort Wilkins (Mich.); Frankenmuth (Mich.); Frankfort (Mich.); Franklin (Mich.); Freeland (Mich.); Fremont (Mich.); Gaylord (Mich.); Gladstone (Mich.); Glen Arbor (Mich.); Glen Haven (Mich.); Glennie (Mich.); Good Hart (Mich.); Grand Haven (Mich.); Grand Marais (Mich.); Grand Rapids (Mich.); Grand Traverse Bay (Mich.); Grayling (Mich.); Greenville (Mich.); Grosse Pointe (Mich.); Gull Lake (Mich.); Gwinn (Mich.); Hamtramck (Mich.); Hancock (Mich.); Harbor Springs (Mich.); Hardy Dam (Mich.); Harper Woods (Mich.); Harrison (Mich.); Hartwick Pines State Park (Mich.); Hastings (Mich.); Hell (Mich.); Hessel (Mich.); Hiawatha National Forest (Mich.); Higgins Lake (Mich.); Highland Park (Mich.); Hillsdale (Mich.); P.J. Hoffmaster State Park (Mich.); Holland (Mich.); Honor (Mich.); Houghton (Mich.); Houghton Lake (Mich.); Indian River (Mich.); Interlochen (Mich.); Interlochen State Park (Mich.); Ionia (Mich.); Irish Hills (Mich.); Iron Mountain (Mich.); Iron River (Mich.); Ironton (Mich.); Ironwood (Mich.); Ishpeming (Mich.); Isle Royale (Mich.); Jackson (Mich.); Kalamazoo (Mich.); Kalkaska (Mich.); Kewadin (Mich.); Lac La Belle (Mich.); Lake Ann (Mich.); Lake City (Mich.); Lake Leelanau (Mich.); L'Anse (Mich.); Lansing (Mich.); Leland (Mich.); Les Cheneaux Islands (Mich.); Lincoln Park (Mich.); Little Girl's Point (Mich.); Little Traverse Bay (Mich.); Livonia (Mich.); Lowell (Mich.); Ludington (Mich.); Ludington State Park (Mich.); Mackinac, Straits of (Mich.); Mackinac Bridge (Mich.); Mackinac Island (Mich.); Mackinac Island (Mich.); Mackinaw City (Mich.); Manistee (Mich.); Manistique (Mich.); Marinette (Wis.); Marion (Mich.); Marquette (Mich.); Mason (Mich.); Mears (Mich.); Menominee (Mich.); Mesick (Mich.); Midland (Mich.); Milford (Mich.); Mio (Mich.); Mitchell State Park (Mich.); Monroe (Mich.); Montague (Mich.); Mount Clemens (Mich.); Mount Pleasant (Mich.); Munising (Mich.); Muskegon (Mich.); Muskegon State Park (Mich.); Naubinway (Mich.); New Buffalo (Mich.); Newaygo (Mich.); Newberry (Mich.); Niles (Mich.); Northport (Mich.); Northville (Mich.); Old Mill Creek State Park (Mich.); Old Mission Point (Mich.); Omena (Mich.); Onekama (Mich.); Orchard Beach State Park (Mich.); Oscoda (Mich.); Otsego Lake State Park (Mich.); Owosso (Mich.); Paradise (Mich.); Paulding (Mich.); Paw Paw (Mich.); Pentwater (Mich.); Peshawbestown (Mich.); Petoskey (Mich.); Petoskey State Park (Mich.); Pictured Rocks National Lakeshore (Mich.); Plymouth (Mich.); Pontiac (Mich.); Porcupine Mountains State Park (Mich.); Port Huron (Mich.); Prudenville (Mich.); Rapid River (Mich.); Reed City (Mich.); Rochester (Mich.); Rockford (Mich.); Rogers City (Mich.); Romulus (Mich.); Roscommon (Mich.); Roseville (Mich.); Royal Oak (Mich.); Saginaw (Mich.); Saint Clair (Mich.); Saint Ignace (Mich.); Saint Johns (Mich.); Saint Joseph (Mich.); Saugatuck (Mich.); Sault Sainte Marie (Mich.); Scottville (Mich.); Seney National Wildlife Refuge (Mich.); Silver Lake (Oceana County, Mich.); Sister Lakes (Mich.); Sleeping Bear Dunes National Lakeshore (Mich.); South Haven (Mich.); South Manitou Island (Mich.); Southfield (Mich.); Spring Lake (Mich.); Sterling Heights (Mich.); Stony Lake (Mich.); Sturgeon Point (Alcona County, Mich.); Sturgis (Mich.); Suttons Bay (Mich.); Upper Falls (Luce County, Mich.); Lower Falls (Chippewa County, Mich.); Tahquamenon River (Mich.); Tawas Bay (Mich.); Tawas Point State Park (Mich.); Taylor (Mich.); Tecumseh (Mich.); Three Rivers (Mich.); Torch Lake (Mich.); Tourism.; Traverse City (Mich.); Trenton (Mich.); Troy (Mich.); Union Pier (Mich.); Vandalia (Mich.); Wakefield (Mich.); Walloon Lake (Mich.); Warren (Mich.); Warren Dunes State Park (Mich.); West Branch (Mich.); Westland (Mich.); White Cloud (Mich.); Whitefish Point (Mich.); Whitehall (Mich.); Yankee Springs Recreation Area (Mich.); Ypsilanti (Mich.)"
Indian,umich-bhl-2016041,abstract,"Indian American Student Association (University of Michigan) records, 1983-2006.","The Indian American Student Association (IASA) of the University of Michigan serves to promote various aspects of Indian culture and heritage through an assortment of events that raise political, social, and cultural awareness."
Indian,umich-bhl-2018025,bioghist,the John P. Murphy collection,"In the earlier years of America’s westward expansion, popular subjects for Native American photography were images of ""renegade"" and ""hostile"" Indian warriors and leaders that contributed to and reinforced racist views of Native Americans."
Indian,umich-bhl-2018007,bioghist,the James R. Hillman papers.,"He gained extensive experience in Native American outreach and educational services at the Minnesota Employment Service, Intertribal Councils of Michigan, federal Bureau of Indian Affairs and as Assistant Indian Education Coordinator at the Michigan Department of Education."
Indian,umich-bhl-2018007,bioghist,the James R. Hillman papers.," The proposed organization would be run by Native Americans and while it would work with the Michigan Commission on Indian Affairs, it would operate independently."
Indian,umich-bhl-2018007,scopecontent,the James R. Hillman papers.,Hillman materials series contains the personal papers of Hillman and documents activities related to his work with the Detroit chapter of the North American Indian Association.
Indian,umich-bhl-2016041,titleproper,"Indian American Student Association (University of Michigan) records, 1983-2006.","Indian American Student Association (University of Michigan) records, 1983-2006."
Indian,umich-bhl-2012009,scopecontent,the Trip to the University of Michigan Outstate Properties.,"Osborn Preserve, Biological Station, Camp Shady Trails Speech Improvement Camp and ""University of Michigan State Park"" (Indian Mounds-Missaukee)."
Indian,umich-bhl-2016041,bioghist,"Indian American Student Association (University of Michigan) records, 1983-2006.","Founded in 1983 by Sam Shekar, the Indian American Student Association (IASA) of the University of Michigan serves to promote various aspects of Indian culture and heritage through an assortment of events that raise political, social, and cultural awareness, as well as fulfill goals aimed at community building, service, and professional development."
Indian,umich-bhl-2018007,scopecontent,the James R. Hillman papers.,Hillman papers contain materials related to the work of the Michigan Commission on Indian Affairs.
Indian,umich-bhl-2018007,abstract,the James R. Hillman papers.,Executive Director of the Michigan Commission on Indian Affairs from 1973-1977.
Indian,umich-bhl-851293,scopecontent,the Peter Dougherty papers,"Reports of missionary activities; letters, 1847-1872, of Andrew Porter, missionary-teacher to Indians at Omena, and Bear Creek (now Petoskey, Emmet County), Michigan; also diaries, 1838-1842 and May 1850, recording trips from New York City to Detroit, Mackinac Island and Chicago via the Erie Canal and the Great Lakes; contain descriptions of Detroit, Mackinac Island, and other towns and places, in Michigan, and of Indian customs and his missionary activities."
Indian,umich-bhl-2016041,subjects,"Indian American Student Association (University of Michigan) records, 1983-2006.",East Indian students; Concerts; Festivals; Music
Indian,umich-bhl-2016041,corpnames,"Indian American Student Association (University of Michigan) records, 1983-2006.",Indian American Student Association (University of Michigan); University of Michigan.
Indian,umich-bhl-2010213,bioghist,"Native American Studies Program (University of Michigan) records, 1972-2003","There are several Native American student groups operating at the University as well, including American Indians at the University of Michigan, The Circle, the American Indian Science Engineering Society, the Native American Law Students Association, and the Native Caucus."
Indian,umich-bhl-2018007,scopecontent,the James R. Hillman papers.,The Michigan Commission on Indian Affairs series contains records related to the work of the Commission between 1970-1981.
Indian,umich-bhl-8592,bioghist,"George Henry Cannon papers, 1833-1915"," His final survey, in 1856, was the laying out of an extensive Indian reservation in Minnesota."
Indian,umich-bhl-85999,scopecontent,"Elizabeth Margaret Chandler Papers, 1793-1854","Burleigh, coeditor with his brother, William Henry, of the abolitionist newspaper <title render=""italic"">The Unionist</title>; a few refer to the financial and mercantile disruption caused by President Andrew Jackson's monetary policy, resulting in the panic of 1837; two letters, 1835, mention the boundary dispute between the State of Ohio and Michigan Territory (the Toledo War); others refer to a controversy between the Hicksite Friends and the Orthodox Friends in New York, the danger of a cholera epidemic, Indian difficulties, the increase of settlers in Michigan Territory, and other contemporary topics; one letter, 1832, encloses a certification of Thomas Chandler's membership in the Society of Friends, and one letter, 1834, encloses a poem on the death of George Dillwyn (1738-1821), Society of Friends preacher."
Indian,umich-bhl-2018007,bioghist,the James R. Hillman papers.,The Commission also worked closely with the federal Bureau of Indian Affairs and other private and non-profit organizations.
Indian,umich-bhl-2018007,bioghist,the James R. Hillman papers.,"As Executive Director of the Michigan Commission on Indian Affairs, Hillman coordinated the actions of the commission and worked to build ties between Native American communities, the legislature and Michigan state agencies."
Indian,umich-bhl-90117,scopecontent,the Ira W. Butterfield collection,"Correspondence and collected documents relating to the O-Gau-Kawning Church of Bangor Township, Bay County, Michigan, an Indian mission, and its predecessor churches."
Indian,umich-bhl-2018025,bioghist,the John P. Murphy collection,"In 1887 a boarding school system was created at Baraga, Harbor Springs, and Mount Pleasant, operating under the principle ""kill the Indian, save the man."" Over the course of decades, hundreds of Native American children were separated from their families and spent years at these schools, with many dying at them."
Indian agent,umich-bhl-851588,abstract,"George Johnston letterbook, 1832-1860","Sub-Indian agent at La Pointe, Wisconsin, later surveyor of Indian lands in Michigan's Upper Peninsula, and interpreter among the Chippewa Indians."
Indian agent,umich-bhl-86143,abstract,C. C. Trowbridge Papers,"Lewis Cass on 1819 expedition among Indians of upper Great Lakes, Indian agent and negotiator, mayor of Detroit in 1834, and later University of Michigan regent."
Indian agent,umich-bhl-86143,scopecontent,C. C. Trowbridge Papers,The Trowbridge collection consists mainly of materials accumulated during the early years of his career when he was acting as Indian agent and when he devoted himself to the study of the languages and customs of the native Americans of the upper midwest.
Indian agent,umich-bhl-86143,bioghist,C. C. Trowbridge Papers,"In 1821, Secretary of War Calhoun appointed Trowbridge as Indian agent with responsibility of accompanying chiefs and representatives of the Six Nations of New York state to Green Bay for the purpose of finding suitable lands where the Six Nations might resettle."
Indian agent,No EAD ID,bioghist,the Henry Rowe Schoolcraft papers,"Author, Indian agent and ethnologist."
Indian agent,umich-bhl-851588,bioghist,"George Johnston letterbook, 1832-1860","In 1826, he was a sub-Indian agent at LaPointe, Wisconsin; later in 1835, he was appointed by the then Secretary of War Lewis Cass to survey the northern Michigan boundary between the Sioux and Chippewa Indians."
Indians,umich-bhl-851542,subjects,Volney H. Jones (1903-1982) Papers,Ethnobotany.; Paleoethnobotany.; Anthropology; Anthropology; Indians of North America; Indians of North America
Indians,umich-bhl-85606,scopecontent,the P. C. Andre papers,"Deeds, indentures, and legal papers, relating to land purchased from Indians in Isabella and Saginaw counties, Michigan."
Indians,umich-bhl-86166,subjects,the Adrian Van Koevering manuscript articles,Dutch Americans; Indians of North America; Journalists; Newspaper publishing
Indians,umich-bhl-85761,scopecontent,the John C. Blanchard papers,"Two legal documents from Chippewa Indians living on Walpole Island, Ontario, granting power of attorney to W."
Indians,umich-bhl-89137,subjects,"Jean Worth Papers, ca. 1869-1986",Alcoholic beverage industry.; Breweries.; Indians of North America; Logging; Lumbering; Veterans; Banks.; Business enterprises; Business enterprises; Carts and wagons.; City & town life; Dwellings; Finnish Americans.; Fires; Hotels and taverns.; Interiors.; Kitchens.; Lighthouses; Lumber industry.; Newspaper carriers.; Parades &amp; processions.; Railroads; Schools; Schools; Shipping; Stilts.; Tracklaying vehicles.
Indians,umich-bhl-92745,subjects,"Ed Beach photographs, 1931-1948",Airports; Animals; Automobiles; Automobile service stations; Barns; Bridges; Churches; Courthouses; Dwellings; Festivals; Freemasons; Indians of North America; Lighthouses; Masonic temples; Mills; Monuments and memorials; Photographers; Railroads; Railroad stations; Roads; Schools; Transportation
Indians,umich-bhl-8722,subjects,Board of Regents (University of Michigan) records,Ojibwa Indians; Ottawa Indians; Potawatomi Indians; Women; Women college students
Indians,umich-bhl-2010192,subjects,"Richard I. Ford papers, 1968-2005",Anthropology.; Ethnobotany.; Indians of North America; Indians of North America; Indians of North America; Paleoethnobotany.
Indians,umich-bhl-85926,scopecontent,the Chauncy Bush minute book,"Harris, and delegations of Sioux and Sauk-Fox Indians from along the Mississippi River, including the Sauk-Fox chief Keokuk."
Indians,umich-bhl-85926,subjects,the Chauncy Bush minute book,Indians of North America.
Indians,umich-bhl-851538,subjects,"W. B. Hinsdale papers, 1893-1942 (bulk 1922-1938)",Archaeology.; Homeopathy; Medicine; Physicians; Archaeology.; Excavations (Archaeology); Indians of North America
Indians,umich-bhl-851538,bioghist,"W. B. Hinsdale papers, 1893-1942 (bulk 1922-1938)","Wahr, 1930), <title render=""italic"">The Indians of Washtenaw County, Michigan</title> (G."
Indians,umich-bhl-85109,subjects,"Elzada U. Clover papers, 1938-1944",Botany.; Scientific expeditions; Botanists; Women botanists; Travelers; Women travelers; Botany.; Expeditions and surveys.; Indians of North America.; Women.
Indians,umich-bhl-85108,subjects,the Campau family papers,Medicine; Indians of North America
Indians,umich-bhl-88175,subjects,the Cog-gog-e-was land patents,Indians of North America; Ojibwa Indians
Indians,No EAD ID,subjects,the Black Hawk visual material collection.,Indians of North America.
Indians,umich-bhl-851638,subjects,"Lucius L. Hubbard Papers, 1871-1935",Geology; Indians of North America; Mines and mineral resources; Geology; Copper.
Indians,umich-bhl-8822,subjects,the Reuben Beeman land sale agreements,Ojibwa Indians; Indians of North America
Indians,umich-bhl-86361,scopecontent,the Wood family correspondence,"Drake of Hanover, Michigan, concerning trouble with Indians; and letters from S."
Indians,umich-bhl-00130,subjects,the Fur trading journal,Business records.; Fur trade; Indians of North America
Indians,umich-bhl-88196,scopecontent,the Theo Cornell papers,"Reminiscences, 1973, relating primarily to the kidnapping of her grandfather's brother by Fisher Indians in the region of the Shiawassee-Saginaw Rivers in Saginaw County, Mich.; other scattered materials about the Park family; and transcription of reminiscences of the Robert B."
Indians,No EAD ID,subjects,"the Anonymous Detroit, Michigan, trading company ledger",Business records.; Fur trade; Indians of North America
Indians,umich-bhl-2012101,subjects,the John Christian Auch papers,Indians of North America; Public lands
Indians,umich-bhl-86361,subjects,the Wood family correspondence,Indians of North America.; Women
Indians,No EAD ID,scopecontent,"the Anonymous Detroit, Michigan, trading company ledger",Record of accounts with Indians throughout the Northwest Territory.
Indians,No EAD ID,subjects,"the Ka-na-pi-ma [graphic] : an Ottawa chief / drawn, printed &amp; coloured at J. T. Bowen's lithographic establishment, No. 94, Walnut Street.",Indians of North America
Indians,umich-bhl-2010213,bioghist,"Native American Studies Program (University of Michigan) records, 1972-2003","There are several Native American student groups operating at the University as well, including American Indians at the University of Michigan, The Circle, the American Indian Science Engineering Society, the Native American Law Students Association, and the Native Caucus."
Indians,umich-bhl-85606,subjects,the P. C. Andre papers,Indians of North America
Indians,No EAD ID,subjects,the Francis S. Belton drawing collection.,Indians of North America; Ships
Indians,umich-bhl-85831,subjects,Joseph Beal Steere Papers,Evolution; Naturalists; Philosophy.; Scientific expeditions.; Travelers.; Voyages and travels.; Zoology.; Expeditions and surveys.; Indians of South America.
Indians,umich-bhl-85831,bioghist,Joseph Beal Steere Papers,"He studied the Hypurinas, Jamadi, and Paumari Indians."
Indians,umich-bhl-86395,subjects,"Peter Barbeau Papers, 1789-1909",Bridges.; Business records.; Fishing; Fur trade; Indians of North America; Lighthouses; Logging; Lumbering; Mines and mineral resources; Shipping
Indians,umich-bhl-86934,subjects,"Holy Cross Church (Cross Village, Mich.) records, 1847-1930","Indians of North America; Indians of North America; Registers of births, etc."
Indians,umich-bhl-87423,subjects,the American Baptist Missionary Union records,Baptists; Indians of North America; Indians of North America; Missions
Indians,umich-bhl-87423,scopecontent,the American Baptist Missionary Union records,"Mills and includes a land grant dated January 1850 that details how the proceeds from the sale of lands along the Grand River (probably near Grand Rapids, Mich.) under the provisions of a treaty between the United States and the Ottawa and Chippewa Indians should be divided between Baptist and Catholic missionary interests, both of whom had developed missions in the area."
Indians,umich-bhl-8821,subjects,"Dept. of History (University of Michigan) Student Papers, 1930-1987","Academic freedom.; Actresses.; African Americans; Ann Arbor argus.; Mayors; Automobile industry and trade; Birth control.; British Americans; Canals.; Civil service.; Communist college teachers.; Congregational churches.; Conservation of natural resources; Copper mines and mining; Cornish; Demography.; Depressions; Depressions; Detroit gazette.; Schools; Drama.; Dutch Americans; Education; Elections; Elections; Elections; Elections; Elections; Elections; Elections; Family.; Farm life; Folklore.; Football; Forests and forestry; Frontier and pioneer life; Furniture industry and trade; Gazetteer of the state of Michigan.; German Americans; Good Roads Movement.; Grape industry.; Greek letter societies; Hazing; Indians of North America; Industries; American newspapers; Insurance; Iosco County gazette.; Kindergarten.; Labor; Legislation; Libel and slander.; Libraries; Logging; Lumberman's Memorial (Iosco County, Mich.); Lyceums; Medicine; Mennonites; Michigan daily.; Migration, Internal.; Missions; Missionaries; Municipal government; Music; American newspapers; Schools; Ojibwa Indians.; Peace; Police; Prisons; Progressivism (United States politics); Prohibition; Public lands; Public welfare; Railroads; Reconstruction (U.S. history, 1865-1877); Resorts; Roads; Plank roads; Royal Oak daily tribune.; Schools; Shipping; Antislavery movements; Steel industry and trade; Strikes and lockouts; Taxation; Theaters; Transportation; Universities and colleges; Water power.; Western Methodist Protestant.; Women; Women; Women's rights; Young Men's Christian Associations.; Spanish-American War, 1898.; Mexican War, 1846-1848.; World War, 1914-1918; World War, 1914-1918; Women college students; World War, 1939-1945."
Indians,umich-bhl-86550,subjects,Alexander G. Ruthven Papers,"African Americans; Anti-Nazi Movement; Antisemitism; Athletics; Child welfare.; Conservation of natural resources.; Dormitories; Draft; Drugs; Education; Elections; Greek letter societies; Indians of North America; New Deal, 1933-1939; Peace; Prohibition; Radicalism; Refugees.; Women's rights; Working class; World War, 1939-1945.; World War, 1939-1945; World War, 1939-1945; Weddings."
Indians,umich-bhl-85743,subjects,the John R. Baker papers,Indians of North America; Land use; Lawyers
Indians,umich-bhl-88196,subjects,the Theo Cornell papers,Indians of North America
Indians,umich-bhl-86376,subjects,the Charles N. Youngblood letter,Indians of North America.
Indians,umich-bhl-88236,scopecontent,"the Detroit, Michigan, papers","Agreement, 1775, among Detroit merchants to regulate sale of liquor to Indians [photostat]; census, 1796, detailing number of male inhabitants and number of buildings [photostat]; taxroll, January 1818, including names of persons subject to tax and amount of their taxes; petitition, 1864, requesting local navy recruiting office; and meteorological summary, October-November, 1888."
Indians,umich-bhl-89128,subjects,the Orla Peterson papers,Indians of North America; Indians of North America; Potawatomi Indians.
Indians,umich-bhl-89139,bioghist,the Charles H. Rodd papers,"Part-Indian trader at Midland, Michigan, and interpreter with the Chippewa Indians of Isabella County, Michigan."
Indians,umich-bhl-89139,subjects,the Charles H. Rodd papers,Business records.; Fur trade; Indians of North America
Indians,No EAD ID,scopecontent,the Henry Rowe Schoolcraft papers,"Letter to President Zachary Taylor urging an appointment for Schoolcraft, letter to John Torrey about Douglass Houghton and Indians around Sault Ste."
Indians,No EAD ID,subjects,the Henry Rowe Schoolcraft papers,Indians of North America; Indians of North America; Journalists; Missionaries; American newspapers
Indians,umich-bhl-85189,subjects,Amos R. Green Papers,Anthropology.; Archaeology.; Indians of North America; Michigan; Archaeology.; Fossils.; Indian weapons; Mills
Indians,umich-bhl-89425,scopecontent,the Elmer E. White court file,"the Regents of The University of Michigan, concerning the claims of these Indians against the University under the provisions of a treaty negotiated in 1817; include plaintiff's exhibits containing historical background of the case; and decision, February 1979, of Judge Edward D."
Indians,umich-bhl-89425,subjects,the Elmer E. White court file,Indians of North America
Indians,umich-bhl-851315,subjects,"James Oliver Curwood papers, 1897-1927","Authors, American; Conservation of natural resources; Forest fires; Hunting.; Motion picture industry.; Water.; Animals.; Camping.; Dogsleds.; Fishing; Hunting; Indians of North America; Log cabins.; Lumber industry.; Pollution.; Women."
Indians,umich-bhl-2020007,subjects,the Rick Snyder papers.,Agriculture; Bankruptcy; Diversification in industry; Drinking water; Education; Emergency management; Governors; Indians of North America; Lieutenant governors; Republican Party (Mich.); Urban renewal; Water quality; Water quality management
Indians,umich-bhl-851813,subjects,"Stevens Thomson Mason Papers, 1827-1842",Indians of North America; Governors; Dwellings; Sculpture.
Indians,umich-bhl-2018007,subjects,the James R. Hillman papers.,Indians of North America; Indians of North America; Indians of North America; Indians of North America
Indians,umich-bhl-89128,scopecontent,the Orla Peterson papers,"Letters, drafts of legal documents, and other material concerning the claims of the Potawatomi Indians in Michigan and Indiana against the United States government."
Indians,umich-bhl-2018007,bioghist,the James R. Hillman papers.,"In 1974, Hillman drafted a proposal entitled “A Trust for Indians” which proposed the creation of tax-exempt organization to administer funds to other Native American organizations."
Indians,umich-bhl-851568,scopecontent,the Isabella Indian Mission historical sketch,"History of the missionary activities of the Methodist Episcopal Church among the Chippewa Indians in Isabella County, Michigan and vicinity, 1841-1890."
