Term,Occurrence (ead_ID),Tag,Collection,Context
Dwellings,umich-bhl-92745,subjects,"Ed Beach photographs, 1931-1948",Airports; Animals; Automobiles; Automobile service stations; Barns; Bridges; Churches; Courthouses; Dwellings; Festivals; Freemasons; Indians of North America; Lighthouses; Masonic temples; Mills; Monuments and memorials; Photographers; Railroads; Railroad stations; Roads; Schools; Transportation
Dwellings,umich-bhl-851362,subjects,"Emerson Frank Greenman Papers, 1888-1984 (bulk dates, 1924-1972)",Education; Indians of North America; Archaeology.; Excavations (Archaeology); Indians of North America.; African Americans; Boats.; Churches.; Courthouses; Cutover lands.; Dwellings.; Fire engines and equipment.; Hotels and taverns; Indians of North America.; Log cabins.; Lumber industry; Military parades and ceremonies.; Mills; Excavations (Archaeology)
Dwellings,umich-bhl-2018025,subjects,the John P. Murphy collection,Accidents.; Boat and ship industry.; Buildings.; Camps.; Canals.; Canoes.; Carts and wagons.; Cemeteries.; Children and adults.; Construction.; Copper mining.; Dwellings.; Fires.; Fishing.; Forts and fortifications.; Hunting.; Indians of North America; Iron mining.; Lumber industry.; Mills.; Miners.; Mining.; Nature.; Ojibwa Indians.; Recreation.
Dwellings,umich-bhl-851713,subjects,Victor F. Lemmer Papers,"American newspapers; Business records.; Indians of North America; Iron mines and mining; Banks.; Buildings; Business enterprises; Children.; Dwellings.; Fires.; Hotels and taverns.; Indians of North America.; Interiors.; Iron mining.; Lumber industry.; Mining.; Music; Soda fountains.; Spanish-American War, 1898.; Women.; World War, 1914-1918.; World War, 1939-1945."
Dwellings,umich-bhl-2009196,subjects,Michigan Historical Collections topical photograph collection,"Architecture.; Automobile industry.; Automobiles.; Baseball.; Bathing suits.; Bridges; Buses.; Cadillac (Mich.); Camping.; Cargo ships.; Carriages and coaches.; Carts and wagons.; Chauffeurs.; Children.; Children's clothing and dress.; Churches; Clothing and dress; Cookery.; Copper mining; Cutover lands.; Dams; Danish Americans.; Deer hunting.; Diving.; Dwellings; Eating and drinking.; Electric railroads.; Emigration and immigration.; Ethnic groups.; Families.; Farms.; Ferries.; Finnish Americans.; Forestry.; Forests; Funeral rites and ceremonies.; General stores; German Americans.; Harbors; Historical markers; Horses.; Hunting; Indians of North America; Iron mining.; Laborers.; Living rooms; Logs.; Lumber industry.; Lumber industry; Military camps.; Military life.; Military maneuvers.; Military officers.; Military parades and ceremonies.; Miners.; Mining.; Musical instruments.; Offices; Ox teams.; Parades &amp; processions.; Parties.; Physicians; Pianos.; Polish Americans.; Port Huron (Mich.); Port Huron (Mich.); Railroad accidents.; Railroad employees.; Railroad facilities.; Railroad locomotives.; Railroads; Shay (Steam locomotive); Ship accidents.; Shipping; Skid roads.; Sleds and sleighs.; Soldiers; Spanish-American War, 1898.; Sports.; Steamboats.; Street-railroads; Street-railroads; Street-railroads; Street-railroads; Streets; Streets; Streets; Streets; Swimming.; Winter.; Women.; Woodcutting.; Ypsilanti (Mich.)"
Fox,umich-bhl-85926,scopecontent,the Chauncy Bush minute book,"Harris, and delegations of Sioux and Sauk-Fox Indians from along the Mississippi River, including the Sauk-Fox chief Keokuk."
Fox,umich-bhl-0383,bioghist,George R. Fox (1880-1963) Papers,"George Randall Fox was born in Peabody, Kansas on May 18, 1880 and grew up in Wisconsin."
Fox,umich-bhl-0383,scopecontent,George R. Fox (1880-1963) Papers,"Fox Papers are arranged in four series: Cass County, Archaeology and History Manuscripts, Correspondence, and Photographs."
Fox,umich-bhl-0383,abstract,George R. Fox (1880-1963) Papers,Fox was an amateur Michigan archaeologist and author.
Fox,umich-bhl-0383,titleproper,George R. Fox (1880-1963) Papers,Fox (1880-1963) Papers
Fox,umich-bhl-0383,bioghist,George R. Fox (1880-1963) Papers,"E.K. Warren asked Fox to serve for several months as the curator of a new museum they planned to establish in Three Oaks, Michigan called the Chamberlain Museum (the collections of the Chamberlain Museum later formed the basis of the Michigan State University Museum)."
Fox,umich-bhl-9940,bioghist,"James J. Blanchard Papers, 1982-2002",James Blanchard married Janet Fox in the fall of 1989.
Fox,umich-bhl-8622,bioghist,"Spalding Family Papers, 1808-1910","There, he worked for Fox Brothers store in Hartford, but in 1846, he moved to Sault Ste."
Fox,umich-bhl-0383,bioghist,George R. Fox (1880-1963) Papers," Fox was active in several archaeological organizations, including the Michigan Archaeological Society and the Central States Branch of the American Anthropological Association."
Fox,umich-bhl-0383,bioghist,George R. Fox (1880-1963) Papers, Fox had three daughters and one son.
Fox,umich-bhl-0383,persnames,George R. Fox (1880-1963) Papers,"Fox, George R., 1880-; Fox, George R., 1880-; Fox, George R., 1880-"
Grave,No EAD ID,scopecontent,the Shagonabe family photograph collection,The collection consists of individual and group photos of family members as well as photos of grave markers.
Grave,No EAD ID,abstract,the Shagonabe family photograph collection,Consists of individual and group photos of family members as well as photos of grave markers.
Hiawatha,umich-bhl-92456,geognames,"Penrod/Hiawatha Company Postcard Collection, 1950s-2017","Ada (Mich.); Adrian (Mich.); Albion (Calhoun County, Mich.); Algonac (Mich.); Allen Park (Mich.); Allendale (Mich.); Alma (Mich.); Aloha State Park (Mich.); Alpena (Mich.); Ann Arbor (Mich.); Arcadia (Mich.); Askel (Mich.); Athens (Mich.); Au Sable River (Mich.); Baldwin (Mich.); Battle Creek (Mich.); Bay City (Mich.); Bear Lake (Mich.); Beaver Island (Mich.); Bellaire (Mich.); Belle Isle (Detroit, Mich.); Benton Harbor (Mich.); Benzie State Park (Mich.); Benzonia (Mich.); Berrien Springs (Mich.); Bessemer (Mich.); Bete Grise (Mich.); Beulah (Mich.); Big Bay (Mich.); Big Rapids (Mich.); Birmingham (Mich.); Bloomfield Hills (Mich.); Bob-Lo Amusement Park (Ont.); Boyne City (Mich.); Brighton (Mich.); Brimley (Mich.); Brockway Mountain (Mich.); Buchanan (Mich.); Burt Lake State Park (Mich.); Cadillac (Mich.); Calumet (Mich.); Caro (Mich.); Cassopolis (Mich.); Cedar River (Mich.); Cedar Springs (Mich.); Cedarville (Mich.); Centreville (Mich.); Charlevoix (Mich.); Cheboygan (Mich.); Chelsea (Mich.); Christmas (Mich.); Clare (Mich.); Clinton (Lenawee County, Mich.); Coldwater (Mich.); Coloma (Mich.); Colon (Mich.); Copper Harbor (Mich.); Croton (Mich.); Crystal Falls (Mich.); Curtis (Mich.); De Tour Village (Mich.); Dearborn (Mich.); Decatur (Mich.); Detroit (Mich.); Dexter (Mich.); Dowagiac (Mich.); Drummond Island (Mich.); Dundee (Mich.); Durand (Mich.); Eagle Harbor (Mich.); East Lansing (Mich.); East Tawas (Mich.); Eaton Rapids (Mich.); Elk Rapids (Mich.); Escanaba (Mich.); Fayette (Mich.); Flint (Mich.); Fort Wilkins (Mich.); Frankenmuth (Mich.); Frankfort (Mich.); Franklin (Mich.); Freeland (Mich.); Fremont (Mich.); Gaylord (Mich.); Gladstone (Mich.); Glen Arbor (Mich.); Glen Haven (Mich.); Glennie (Mich.); Good Hart (Mich.); Grand Haven (Mich.); Grand Marais (Mich.); Grand Rapids (Mich.); Grand Traverse Bay (Mich.); Grayling (Mich.); Greenville (Mich.); Grosse Pointe (Mich.); Gull Lake (Mich.); Gwinn (Mich.); Hamtramck (Mich.); Hancock (Mich.); Harbor Springs (Mich.); Hardy Dam (Mich.); Harper Woods (Mich.); Harrison (Mich.); Hartwick Pines State Park (Mich.); Hastings (Mich.); Hell (Mich.); Hessel (Mich.); Hiawatha National Forest (Mich.); Higgins Lake (Mich.); Highland Park (Mich.); Hillsdale (Mich.); P.J. Hoffmaster State Park (Mich.); Holland (Mich.); Honor (Mich.); Houghton (Mich.); Houghton Lake (Mich.); Indian River (Mich.); Interlochen (Mich.); Interlochen State Park (Mich.); Ionia (Mich.); Irish Hills (Mich.); Iron Mountain (Mich.); Iron River (Mich.); Ironton (Mich.); Ironwood (Mich.); Ishpeming (Mich.); Isle Royale (Mich.); Jackson (Mich.); Kalamazoo (Mich.); Kalkaska (Mich.); Kewadin (Mich.); Lac La Belle (Mich.); Lake Ann (Mich.); Lake City (Mich.); Lake Leelanau (Mich.); L'Anse (Mich.); Lansing (Mich.); Leland (Mich.); Les Cheneaux Islands (Mich.); Lincoln Park (Mich.); Little Girl's Point (Mich.); Little Traverse Bay (Mich.); Livonia (Mich.); Lowell (Mich.); Ludington (Mich.); Ludington State Park (Mich.); Mackinac, Straits of (Mich.); Mackinac Bridge (Mich.); Mackinac Island (Mich.); Mackinac Island (Mich.); Mackinaw City (Mich.); Manistee (Mich.); Manistique (Mich.); Marinette (Wis.); Marion (Mich.); Marquette (Mich.); Mason (Mich.); Mears (Mich.); Menominee (Mich.); Mesick (Mich.); Midland (Mich.); Milford (Mich.); Mio (Mich.); Mitchell State Park (Mich.); Monroe (Mich.); Montague (Mich.); Mount Clemens (Mich.); Mount Pleasant (Mich.); Munising (Mich.); Muskegon (Mich.); Muskegon State Park (Mich.); Naubinway (Mich.); New Buffalo (Mich.); Newaygo (Mich.); Newberry (Mich.); Niles (Mich.); Northport (Mich.); Northville (Mich.); Old Mill Creek State Park (Mich.); Old Mission Point (Mich.); Omena (Mich.); Onekama (Mich.); Orchard Beach State Park (Mich.); Oscoda (Mich.); Otsego Lake State Park (Mich.); Owosso (Mich.); Paradise (Mich.); Paulding (Mich.); Paw Paw (Mich.); Pentwater (Mich.); Peshawbestown (Mich.); Petoskey (Mich.); Petoskey State Park (Mich.); Pictured Rocks National Lakeshore (Mich.); Plymouth (Mich.); Pontiac (Mich.); Porcupine Mountains State Park (Mich.); Port Huron (Mich.); Prudenville (Mich.); Rapid River (Mich.); Reed City (Mich.); Rochester (Mich.); Rockford (Mich.); Rogers City (Mich.); Romulus (Mich.); Roscommon (Mich.); Roseville (Mich.); Royal Oak (Mich.); Saginaw (Mich.); Saint Clair (Mich.); Saint Ignace (Mich.); Saint Johns (Mich.); Saint Joseph (Mich.); Saugatuck (Mich.); Sault Sainte Marie (Mich.); Scottville (Mich.); Seney National Wildlife Refuge (Mich.); Silver Lake (Oceana County, Mich.); Sister Lakes (Mich.); Sleeping Bear Dunes National Lakeshore (Mich.); South Haven (Mich.); South Manitou Island (Mich.); Southfield (Mich.); Spring Lake (Mich.); Sterling Heights (Mich.); Stony Lake (Mich.); Sturgeon Point (Alcona County, Mich.); Sturgis (Mich.); Suttons Bay (Mich.); Upper Falls (Luce County, Mich.); Lower Falls (Chippewa County, Mich.); Tahquamenon River (Mich.); Tawas Bay (Mich.); Tawas Point State Park (Mich.); Taylor (Mich.); Tecumseh (Mich.); Three Rivers (Mich.); Torch Lake (Mich.); Tourism.; Traverse City (Mich.); Trenton (Mich.); Troy (Mich.); Union Pier (Mich.); Vandalia (Mich.); Wakefield (Mich.); Walloon Lake (Mich.); Warren (Mich.); Warren Dunes State Park (Mich.); West Branch (Mich.); Westland (Mich.); White Cloud (Mich.); Whitefish Point (Mich.); Whitehall (Mich.); Yankee Springs Recreation Area (Mich.); Ypsilanti (Mich.)"
Hiawatha,umich-bhl-86727,bioghist,"Stellanova Osborn papers, 1907-1988","Osborn, ex-Governor of Michigan, and collaborated with him on five books: <title render=""italic"">The Conquest of a Continent</title>, 1939; <title render=""italic"">Schoolcraft-Longfellow-Hiawatha</title>, 1942; <title render=""italic"">Hiawatha with its Original Indian Legends</title>, 1944; <title render=""italic"">Errors in the U.S. Official Area Figures</title>, 1945; and <title render=""italic"">Northwood Sketches</title>, 1949."
Hiawatha,umich-bhl-92456,corpnames,"Penrod/Hiawatha Company Postcard Collection, 1950s-2017","Penrod/Hiawatha Company.; Eloise (Hospital : Wayne County, Mich.); Penrod/Hiawatha Company."
Hiawatha,umich-bhl-92456,titleproper,"Penrod/Hiawatha Company Postcard Collection, 1950s-2017","Penrod/Hiawatha Company Postcard Collection, 1950s-2017"
Hiawatha,umich-bhl-92456,scopecontent,"Penrod/Hiawatha Company Postcard Collection, 1950s-2017","The Penrod/Hiawatha Company collection is mainly comprised of postcards, although some supplemental photographic items directed toward tourists is also included."
Hiawatha,umich-bhl-92456,bioghist,"Penrod/Hiawatha Company Postcard Collection, 1950s-2017","The Penrod/Hiawatha Company of Berrien Springs, Michigan, produces and distributes postcards and other photographic items for tourists."
Hiawatha,umich-bhl-2018025,bioghist,the John P. Murphy collection,"For example, (B2-20) depicts an elderly Ojibway woman who is described as ""Old Nokomis"" after the character in Henry Longfellow’s <i>The Song of Hiawatha</i>."
Indian,umich-bhl-85221,bioghist,Johnston Family Papers,"Schoolcraft, the noted Indian scholar and government Superintendent of Indian Affairs; Eliza (1802-1885); Charlotte (1806-1871); William (b."
Indian,umich-bhl-85221,scopecontent,Johnston Family Papers,"The collection falls into three series: Johnston family papers, Collected historical and Indian materials, and Photographs."
Indian,No EAD ID,bioghist,the James H. Kidd papers,"Officer in the 6th Michigan Cavalry and later in the 2nd Brigade, 3rd Cavalry of the Army of the Potomac during the Civil War and participant in the Powder River Indian campaign of 1865, later Ionia, Michigan newspaper editor and officer in the Michigan State Troops (later the National Guard)."
Indian,No EAD ID,bioghist,the Henry Rowe Schoolcraft papers,"Author, Indian agent and ethnologist."
Indian,No EAD ID,scopecontent,the Henry Rowe Schoolcraft papers,"Cleveland about an Indian treaty, and ""The Literary Voyager; or, Muzzeniegun,"" a manuscript newspaper published at Sault Ste."
Indian,umich-bhl-85221,abstract,Johnston Family Papers,"Correspondence, photographs, and other papers of John Johnston, fur trader, son John McDouall Johnston, Indian interpreter for Henry R."
Indian,umich-bhl-85395,scopecontent,the Sherman family papers,"Papers of Abner John Sherman, Indian trader, merchant, and Upper Peninsula state representative, his son, John A."
Indian,umich-bhl-85243,abstract,"W. Wallace Kent papers, 1954-1973","Case docket sheets, judges' case files, unpublished opinions, judges' memoranda, Court of Appeals panel reports, Court of Appeals Circuit Council reports; cases relate in part to school desegregation, Indian treaty rights, labor relations, and questions of civil liberties."
Indian,umich-bhl-89139,bioghist,the Charles H. Rodd papers,"Part-Indian trader at Midland, Michigan, and interpreter with the Chippewa Indians of Isabella County, Michigan."
Indian,umich-bhl-85189,subjects,Amos R. Green Papers,Anthropology.; Archaeology.; Indians of North America; Michigan; Archaeology.; Fossils.; Indian weapons; Mills
Indian,umich-bhl-2016035,scopecontent,American Indian Services records,Articles cover Native American related stories in Southeast Michigan and document the work of American Indian Services Executive Director Fay Givens.
Indian,umich-bhl-2016035,abstract,American Indian Services records,"The American Indian Services (AIS) is a non-profit organization which administers Federal programs for Native American families in Southeast Michigan, predominantly in metropolitan Detroit."
Indian,No EAD ID,scopecontent,the John M. Munson photograph collection.,Portraits and photos of Munson taking part in an Indian ceremony.
Indian,umich-bhl-851272,bioghist,Ferry Family Papers (William Montague Ferry family),"He then offered his services to the <corpname>United Foreign Missionary Society</corpname>, and was subsequently appointed to explore and preach among the Indian tribes of the northwest."
Indian,umich-bhl-88154,corpnames,"Lewis Cass papers [microform], 1814-1847",Office of Indian Affairs.
Indian,umich-bhl-88154,scopecontent,"Lewis Cass papers [microform], 1814-1847","The series in the collection are: United States Minister to France, United States Secretary of War, Michigan Superintendency of Indian Affairs, and United States Office of Indian Affairs."
Indian,umich-bhl-88154,abstract,"Lewis Cass papers [microform], 1814-1847","Minister to France and Secretary of War; also official documents of the Michigan Superintendency of Indian Affairs, 1819-1831, and the Office of Indian Affairs, 1814-1817 and 1822-1829, relating in part to Cass's work in negotiating land treaties with the Indians of the Michigan Territory."
Indian,umich-bhl-85150,abstract,"Marvin Fisher papers, 1972-1976","Chippewa Indian from Bay City, Michigan."
Indian,umich-bhl-85150,bioghist,"Marvin Fisher papers, 1972-1976","Marvin Fisher was a Chippewa Indian activist from Bay City, Michigan."
Indian,umich-bhl-0384,bioghist,Melvin R. Gilmore (1868-1940) Papers,He served on the staff of the Heye Foundation's Museum of the American Indian from 1923 to 1928.
Indian,umich-bhl-0384,bioghist,Melvin R. Gilmore (1868-1940) Papers,"Other major publications included <title render=""italic"">Prairie Smoke</title> (Columbia University Press, 1929), a collection of Native American myths, and the pamphlet <title render=""italic"">Indian Lore and Indian Gardens</title> (Slingerland-Comstock Co., 1930)."
Indian,umich-bhl-2016035,titleproper,American Indian Services records,American Indian Services records
Indian,umich-bhl-0384,corpnames,Melvin R. Gilmore (1868-1940) Papers,"Museum of Anthropology.; Museum of the American Indian, Heye Foundation.; Museum of the American Indian, Heye Foundation.; St. Francis Mission (Saint Francis, S.D.)"
Indian,umich-bhl-86811,bioghist,the Omena Presbyterian Church records,"Indian mission established by Peter Dougherty at Old Mission, Michigan, in 1839, and moved to Omena, Michigan, in 1852."
Indian,umich-bhl-851568,corpnames,the Isabella Indian Mission historical sketch,Isabella Indian Mission (Mich.); Methodist Episcopal Church.; Methodist Episcopal Church.
Indian,umich-bhl-851568,titleproper,the Isabella Indian Mission historical sketch,the Isabella Indian Mission historical sketch
Indian,umich-bhl-85189,abstract,Amos R. Green Papers,"Biographical and personal material; correspondence; publications; talks, radio interviews and other public presentations; archeological site notes and reports; research sources and notes; maps; photographs; and files relating to his activities with the southwest chapter, Michigan Archeological Society; contain materials relating to his interest in the archaeology, Indian anthropology, and history of the area around Berrien and Cass Counties; also papers documenting his relationship with professionals in various disciplines at the University of Michigan Museums and elsewhere."
Indian,umich-bhl-2016035,corpnames,American Indian Services records,American Indian Services.; American Indian Services.; American Indian Services.
Indian,umich-bhl-2016035,bioghist,American Indian Services records,"In 1971, Harry Fay Command founded the American Indian Services (AIS) in the Southeast Michigan, as an extension of the Thunderbird Alcoholics Anonymous Club."
Indian,umich-bhl-88326,bioghist,"Michigan Ecumenical Forum records, 1916-2002","Issues such as church location, world hunger, Christian education, protest against the Vietnam War, Indian and migrant missions, criminal justice, pastoral education, and race relations found their way onto the MCC agenda from 1957 through 1986."
Indian,umich-bhl-2016035,scopecontent,American Indian Services records,"The dates of these events range from the 1990s to the 2000s and cover disputes of how local, state, and national governments handle American Indian affairs."
Indian,umich-bhl-2016035,scopecontent,American Indian Services records,"The American Indian Services (AIS) records primarily consist of board meeting minutes, legal documents, newspaper clippings, and photographs."
Indian,umich-bhl-93805,bioghist,"Zonta Club of Ann Arbor, Michigan records, 1972-1990","Zonta is a Sioux Indian word meaning ""to band together for a purpose."" The creators of Zonta International, a service organization of executive women in business and other professions, wanted the organization to represent such values as honesty, trust and inspiration."
Indian,umich-bhl-86481,scopecontent,the Monaghan family papers,"Monaghan, soldier in the 7th Michigan Cavalry, Co. I, describing Civil War campaigns in Virginia and Indian campaigns in Colorado; also assorted other letters and genealogical notes of Ida W."
Indian,umich-bhl-2011121,bioghist,"Camp Al-Gon-Quian (Burt Lake, Mich.) records, 1926-1967"," Twining chose the name Al-Gon-Quian because he believed that was a possible Native American expression for ""bow of a canoe."" Twining also borrowed several Indian names for the camper groups."
Indian,umich-bhl-851865,titleproper,the Michigan Indian Agency land register,the Michigan Indian Agency land register
Indian,umich-bhl-86934,abstract,"Holy Cross Church (Cross Village, Mich.) records, 1847-1930","Baptismal records, marriage, birth and death records, photographs, newspaper clippings and printed histories detailing activities of this Indian church."
Indian,umich-bhl-8822,scopecontent,the Reuben Beeman land sale agreements,"Mortgage and warranty deed of Beeman of Saginaw, Michigan, with Sa-Wa-Bon, Chippewa Indian, for land in Saginaw County, Michigan."
Indian,umich-bhl-86934,scopecontent,"Holy Cross Church (Cross Village, Mich.) records, 1847-1930","The records of the church date back to 1847 and include baptismal records, marriage, birth and death records, photographs, newspaper clippings and printed histories detailing activities of this Indian church."
Indian,umich-bhl-86395,bioghist,"Peter Barbeau Papers, 1789-1909","He purchased and resided in the former Indian Agency house, previously the residence of Henry Schoolcraft."
Indian,umich-bhl-85743,scopecontent,the John R. Baker papers,"Usher (1863), and John Wilson (1854), concerning Indian lands and Indian affairs in Michigan; and legal documents relating to John Allen (1846), Albert Mears, and Nathan Mears."
Indian,umich-bhl-87274,bioghist,"President (University of Michigan) Records, 1967-2015","In 2013, Coleman visited India and signed agreements with Indian partners to expand research in medicine and social science."
Indian,umich-bhl-2012101,geognames,the John Christian Auch papers,Saginaw Chippewa Indian Tribe of Michigan.
Indian,umich-bhl-00130,scopecontent,the Fur trading journal,"Ledger book used by unidentified Mackinac Island, Mich., merchants for three separate purposes: accounts of fur traders (1803-1809), Indian credit book (1828), and miscellaneous business accounts (1840-1852)."
Indian,umich-bhl-0154,geognames,"Balthazar Korab photograph collection, ca. 1950-1997","and Ont.); Dundee (Mich.); Fayette (Mich.); Fenton (Mich.); Fort Wilkins (Mich.); Frankenmuth (Mich.); Grass Lake (Mich.); Grindstone City (Mich.); Grosse Pointe (Mich.); Hancock (Mich.); Harbor Springs (Mich.); Highland Park (Mich.); Houghton (Mich.); Howell (Mich.); Huron City (Mich.); Huron County (Mich.); Indian Village (Detroit, Mich.); Jackson (Mich.); Kalamazoo (Mich.); Keweenaw County (Mich.); Lake County (Mich.); L'Anse (Mich.); Lansing (Mich.); Lapeer (Mich.); Ludington (Mich.); Mackinac Bridge (Mich.); Mackinac Island (Mich.); Manchester (Mich.); Manistique (Mich.); Marquette (Mich.); Marshall (Mich.); Menominee (Mich.); Michigamme (Mich.); Monroe (Mich.); Monroe County (Mich.); Mount Clemens (Mich.); Mount Pleasant (Mich.); Muskegon (Mich.); Oakland County (Mich.); Otsego County (Mich.); Owosso (Mich.); Oxford (Mich.); Pequaming (Mich.); Petoskey (Mich.); Port Austin (Mich.); Port Hope (Mich.); Port Huron (Mich.); River Rouge (Mich.); Rogers City (Mich.); Romeo (Mich.); Saginaw (Mich.); Sanilac County (Mich.); Saint Clair River (Mich."
Indian,umich-bhl-8662,scopecontent,the George Nelson Smith papers,"Volume containing diary, 1842-1845, and minute book of the Michigan Association of Congregational Churches, 1837-1841; diary/memoranda books, 1849 and 1857; and scattered correspondence and other papers about Indian affairs."
Indian,umich-bhl-86436,corpnames,"Charles M. Ziegler papers, 1928-1959",Emergency Welfare Relief Commission.; Michigan Indian Foundation.; Mackinac Bridge Authority (Mich.); Michigan Republican League.; Michigan.
Indian,umich-bhl-86436,abstract,"Charles M. Ziegler papers, 1928-1959","Correspondence, scrapbooks and other papers concerning the highway department, Republican politics, and his interest in the Michigan Republican League, the Michigan Indian Foundation, and the construction of the Mackinac Bridge; also photographs."
Indian,umich-bhl-2014119,corpnames,"William Edward Wise visual materials collection, 1948-1955","First Unitarian Church (Ann Arbor, Mich.); Western Unitarian Conference.; American Anti-Imperialist League.; American League to Limit Armaments.; Canada India League.; Friends of Freedom for India.; Friends of India's Independence.; Hindustan Association of America.; India Academy of America.; India Independence League of America.; Indian National Congress."
Indian,umich-bhl-85526,bioghist,Isaac M. Weston Papers,"In 1862, he participated in the Little Crow Indian Campaign serving as a lieutenant with a Minnesota regiment."
Indian,umich-bhl-93343,bioghist,Emil Weddige Papers,"Emil Albert Weddige was born in 1907 in Sandwich, Ontario, Canada to American parents of French, German and Windot Indian (Native American) background."
Indian,umich-bhl-2008043,abstract,"Gertrude P. Kurath recordings of Native American songs, 1953-1954e","The Kurath collection includes two field recordings entitled, ""Michigan Indian Hymns"" and ""Michigan Indian Native Songs"", produced by Gertrude P."
Indian,umich-bhl-86143,abstract,C. C. Trowbridge Papers,"Lewis Cass on 1819 expedition among Indians of upper Great Lakes, Indian agent and negotiator, mayor of Detroit in 1834, and later University of Michigan regent."
Indian,umich-bhl-86143,scopecontent,C. C. Trowbridge Papers,The Trowbridge collection consists mainly of materials accumulated during the early years of his career when he was acting as Indian agent and when he devoted himself to the study of the languages and customs of the native Americans of the upper midwest.
